{
  "schemaVersion": "2.0.0",
  "reviewId": "REVIEW-2026-09-05-PSO-125",
  "generatedAt": "2026-09-05T17:10:00.000Z",
  "sourceReport": "reports/code-audit-findings.json",
  "sourceAuditId": "AUDIT-2026-09-05-PSO-125",
  "summary": { "total": 1, "confirmed": 1, "needsMoreEvidence": 0, "disputed": 0, "falsePositive": 0 },
  "repositoryEvidence": {
    "localGit": {
      "status": "partial",
      "revision": "519095930b7deb08606380e7ea9f014ff2b07416 plus report-only evidence updates",
      "worktreeDirty": true,
      "shallow": false,
      "reachableCommitCount": 31,
      "scannedRefs": ["refs/heads/*", "refs/remotes/*", "refs/tags/*"],
      "limitations": ["Remote-only refs were not fetched.", "Unreachable and pruned objects were not assessed."]
    },
    "secretScanning": {
      "status": "completed",
      "scanner": "Gitleaks",
      "version": "8.30.1",
      "configurationDigest": "e9ba7656309b23cb5b7d00aa9b7dde346caaec9c88dbd435ebaea98dde6975a4",
      "scopes": ["worktree", "staged", "untracked-distributable", "tracked-reports", "all-local-refs", "reachable-history"],
      "findingCount": 0,
      "limitations": ["Remote-only refs were not fetched.", "Unreachable and pruned objects were not assessed."]
    },
    "hostedRepository": {
      "provider": "github",
      "status": "completed",
      "checkedAt": "2026-09-05T17:05:00.000Z",
      "controls": [
        {"id":"GITHUB-BRANCH-CHECKS","title":"Required branch checks and history protection","status":"conformant","evidence":["Main requires strict Aggregate cross-platform evidence and JavaScript security analysis checks with admin enforcement, linear history, conversation resolution, and no force pushes or deletions."],"limitations":[]},
        {"id":"GITHUB-SECRET-PROTECTION","title":"Hosted secret prevention and detection","status":"conformant","evidence":["Secret scanning and push protection are enabled; local pinned Gitleaks adds worktree and history coverage."],"limitations":["Non-provider patterns and validity checks remain unavailable or disabled."]},
        {"id":"GITHUB-DEPENDENCY-PROTECTION","title":"Dependency vulnerability management","status":"conformant","evidence":["Vulnerability alerts, Dependabot security updates, and automated security fixes are enabled."],"limitations":[]},
        {"id":"GITHUB-ACTIONS-POLICY","title":"Least-privilege Actions policy","status":"conformant","evidence":["Actions are restricted to GitHub-owned actions and workflows use commit-pinned actions with read-only default tokens except scoped CodeQL security-events write."],"limitations":[]},
        {"id":"GITHUB-CODEQL","title":"Code scanning analysis","status":"conformant","evidence":["CodeQL run 33980792246 passed for 5190959; all 11 warnings were reviewed and dispositioned with zero open alerts."],"limitations":[]},
        {"id":"GITHUB-HUMAN-REVIEW","title":"Independent source review","status":"non-conformant","evidence":["Only one write-capable collaborator exists and required pull-request reviews are not configured."],"limitations":["A second qualified reviewer identity is required before enforcement can be enabled without lockout."]}
      ],
      "limitations": ["Remote-only refs, unreachable objects, and unqueried collaboration stores remain outside assessed scope."]
    }
  },
  "standards": [
    {"id":"microsoft-sdl","title":"Microsoft Security Development Lifecycle","publisher":"Microsoft","version":"retrieval-date-2026-09-04","reference":"https://www.microsoft.com/securityengineering/sdl/practices","accessedAt":"2026-09-04","applicability":"applicable","rationale":"The repository develops and distributes software automation.","controls":[{"id":"LOCAL-MSDL-EVIDENCE","title":"Secure development evidence","status":"blocked","evidence":["Local tests, threat model, and fail-closed release gates exist."],"limitations":["Current external guidance retrieval and independent review were unavailable."]}]},
    {"id":"microsoft-cloud-security-benchmark","title":"Microsoft Cloud Security Benchmark","publisher":"Microsoft","version":"retrieval-date-2026-09-04","reference":"https://learn.microsoft.com/security/benchmark/azure/overview","accessedAt":"2026-09-04","applicability":"partially-applicable","rationale":"The repository defines Azure templates but this audit did not inspect a deployed environment.","controls":[{"id":"LOCAL-MCSB-DESIGN","title":"Azure design-time security","status":"blocked","evidence":["Managed identity and Key Vault patterns are tested locally."],"limitations":["Deployed Azure posture belongs to audit-azure-environment and was not run."]}]},
    {"id":"azure-well-architected-security","title":"Azure Well-Architected Framework Security","publisher":"Microsoft","version":"retrieval-date-2026-09-04","reference":"https://learn.microsoft.com/azure/well-architected/security/","accessedAt":"2026-09-04","applicability":"partially-applicable","rationale":"Azure infrastructure templates are distributed by this repository.","controls":[{"id":"LOCAL-WAF-SECURITY","title":"Design-time workload security","status":"blocked","evidence":["Architecture and security contracts exist."],"limitations":["Current external checklist and deployed evidence were unavailable."]}]},
    {"id":"owasp-asvs","title":"OWASP Application Security Verification Standard","publisher":"OWASP","version":"retrieval-date-2026-09-04","reference":"https://owasp.org/www-project-application-security-verification-standard/","accessedAt":"2026-09-04","applicability":"partially-applicable","rationale":"The product is a local CLI and project generator rather than a hosted web application.","controls":[{"id":"LOCAL-ASVS-APPLICABILITY","title":"Applicable input and trust-boundary controls","status":"blocked","evidence":["Traversal, symlink, parser, and recovery tests passed."],"limitations":["No current authoritative control-by-control retrieval."]}]},
    {"id":"owasp-top-10","title":"OWASP Top 10","publisher":"OWASP","version":"2021","reference":"https://owasp.org/www-project-top-ten/","accessedAt":"2026-09-04","applicability":"partially-applicable","rationale":"Several injection, integrity, and security-configuration categories apply to generated projects and local automation.","controls":[{"id":"LOCAL-OWASP-TOP10","title":"Applicable common weakness review","status":"blocked","evidence":["Local security and fuzz checks passed."],"limitations":["No external advisory or hosted runtime evidence."]}]},
    {"id":"nist-ssdf","title":"NIST Secure Software Development Framework","publisher":"NIST","version":"SP 800-218 1.1","reference":"https://csrc.nist.gov/pubs/sp/800/218/final","accessedAt":"2026-09-04","applicability":"applicable","rationale":"The repository has a governed software development and release lifecycle.","controls":[{"id":"LOCAL-SSDF-EVIDENCE","title":"Secure development and release evidence","status":"blocked","evidence":["Threat model, tests, pinning, and release gates exist."],"limitations":["Independent review and signed provenance are incomplete."]}]},
    {"id":"cis-controls","title":"CIS Controls","publisher":"Center for Internet Security","version":"retrieval-date-2026-09-04","reference":"https://www.cisecurity.org/controls","accessedAt":"2026-09-04","applicability":"partially-applicable","rationale":"Repository, dependency, access, logging, and vulnerability-management controls are relevant.","controls":[{"id":"LOCAL-CIS-REPOSITORY","title":"Repository operational safeguards","status":"blocked","evidence":["Local workflows and security policy exist."],"limitations":["Hosted GitHub settings and organizational controls were unavailable."]}]},
    {"id":"slsa","title":"Supply-chain Levels for Software Artifacts","publisher":"OpenSSF","version":"retrieval-date-2026-09-04","reference":"https://slsa.dev/spec/","accessedAt":"2026-09-04","applicability":"applicable","rationale":"The repository builds distributable release candidates.","controls":[{"id":"LOCAL-SLSA-PROVENANCE","title":"Artifact provenance and integrity","status":"non-conformant","evidence":["Unsigned candidate checksums exist; trusted signing and provenance are blocked."],"limitations":[]}]},
    {"id":"openssf-scorecard","title":"OpenSSF Scorecard","publisher":"OpenSSF","version":"retrieval-date-2026-09-04","reference":"https://scorecard.dev/","accessedAt":"2026-09-04","applicability":"applicable","rationale":"The project is hosted on GitHub and uses GitHub Actions.","controls":[{"id":"LOCAL-OPENSSF-HOSTED","title":"Hosted repository security posture","status":"blocked","evidence":["Actions are pinned in local workflow files."],"limitations":["Hosted GitHub evidence and Scorecard execution were not approved."]}]}
  ],
  "assurance": {
    "conclusion": "insufficient-evidence",
    "rationale": "Local and hosted validation, checksums, SBOM, provenance, Gitleaks, CodeQL, and hosted safeguards pass for 5190959, but trusted signature, distinct independent review, production verification, and internal artifact monitoring/revocation remain unavailable.",
    "blockingEvidence": ["AUD-0205", "Trusted release signature unavailable", "Distinct signed independent review unavailable", "Production verification blocked"],
    "exceptionCount": 0,
    "expiredExceptionCount": 0
  },
  "findings": [
    {
      "findingId": "AUD-0205",
      "status": "confirmed",
      "title": "Production release assurance evidence is incomplete and stale",
      "category": "configuration",
      "bugType": "Incomplete release assurance",
      "securitySeverity": "medium",
      "confidence": "high",
      "context": "Current source, security, candidate integrity, and cross-platform CI gates pass for 5190959, but trusted signing, a distinct independently signed review, and internal artifact health/revocation remain unavailable, blocking production verification.",
      "riskExplanation": "Consumers cannot prove that a distributed artifact is the tested, reviewed, untampered current build.",